{
  "$schema": "https://human-writing-rules.example/schemas/reviewed-example-catalog.schema.json",
  "version": "1.1.0",
  "spec_revision": "1.0.0",
  "coverage_policy": {
    "topics": "every-registered-value-at-least-once",
    "platforms": "every-registered-value-at-least-once",
    "cross_product_required": false
  },
  "required_sections": [
    "Task framing",
    "Resolved modules",
    "Evidence map",
    "Context gate",
    "Content design",
    "Final artifact",
    "Media decision",
    "Source notes",
    "Review result"
  ],
  "required_reviewers": [
    "reviewer.source",
    "reviewer.language",
    "reviewer.human-signals",
    "reviewer.format",
    "reviewer.topic",
    "reviewer.platform",
    "reviewer.editor"
  ],
  "examples": [
    {
      "id": "example.ru.article.general",
      "revision": "ru-general-article-r1",
      "status": "reviewed",
      "language": "ru",
      "content_type": "article",
      "topic": "general",
      "platform": "blog",
      "visual_mode": "none",
      "visual_decision": "none",
      "path": "examples/ru/article/general.md",
      "sha256": "3e58b6878dcdf938a9e64a7ddd9e0e92cccf2021f28b67208c167496e5e7e3a9",
      "reviewers": [
        "reviewer.source",
        "reviewer.language",
        "reviewer.human-signals",
        "reviewer.format",
        "reviewer.topic",
        "reviewer.platform",
        "reviewer.editor"
      ],
      "limitations": [
        "Editorial-method example using repository rules; it contains no external mixed-topic claim."
      ]
    },
    {
      "id": "example.ru.article.science",
      "revision": "ru-science-article-example-r2",
      "status": "reviewed",
      "language": "ru",
      "content_type": "article",
      "topic": "science",
      "platform": "blog",
      "visual_mode": "auto",
      "visual_decision": "selected-brief",
      "path": "examples/ru/article/science.md",
      "sha256": "c8bb230f1d5a195f6490f2e898ed927d49005413ba229d98d646d0c0f8b82b21",
      "reviewers": [
        "reviewer.source",
        "reviewer.language",
        "reviewer.human-signals",
        "reviewer.format",
        "reviewer.topic",
        "reviewer.platform",
        "reviewer.visual",
        "reviewer.editor"
      ],
      "limitations": [
        "Method example; it does not describe a real paper or measure newsroom outcomes."
      ]
    },
    {
      "id": "example.ru.article.technology",
      "revision": "ru-technology-article-example-r2",
      "status": "reviewed",
      "language": "ru",
      "content_type": "article",
      "topic": "technology",
      "platform": "blog",
      "visual_mode": "auto",
      "visual_decision": "none",
      "path": "examples/ru/article/technology.md",
      "sha256": "edb686e519a5cbec70fa2f2c4471f925a83985c5a680e638cc9c0ddcb48753c7",
      "reviewers": [
        "reviewer.source",
        "reviewer.language",
        "reviewer.human-signals",
        "reviewer.format",
        "reviewer.topic",
        "reviewer.platform",
        "reviewer.visual",
        "reviewer.editor"
      ],
      "limitations": [
        "Stable architecture rationale is not benchmark evidence of writing-quality improvement or full implementation conformance."
      ]
    },
    {
      "id": "example.ru.article.entertainment",
      "revision": "ru-entertainment-article-example-r2",
      "status": "reviewed",
      "language": "ru",
      "content_type": "article",
      "topic": "entertainment",
      "platform": "blog",
      "visual_mode": "none",
      "visual_decision": "none",
      "path": "examples/ru/article/entertainment.md",
      "sha256": "59c8bc05591fc4da3320df161fbe2ed7fdf17df882fdbc8e4144c1aba6831a4d",
      "reviewers": [
        "reviewer.source",
        "reviewer.language",
        "reviewer.human-signals",
        "reviewer.format",
        "reviewer.topic",
        "reviewer.platform",
        "reviewer.editor"
      ],
      "limitations": [
        "Method example; it does not evaluate, quote, or depict a real work."
      ]
    },
    {
      "id": "example.ru.habr.business-metrics",
      "revision": "ru-habr-business-metrics-r1",
      "status": "reviewed",
      "language": "ru",
      "content_type": "article",
      "topic": "business",
      "platform": "habr",
      "visual_mode": "none",
      "visual_decision": "none",
      "path": "examples/ru/habr/business-metrics.md",
      "sha256": "f93942c4709563e269f8c51aca7ae7248c9fb38842214b2c0b332fa89e307d75",
      "reviewers": [
        "reviewer.source",
        "reviewer.language",
        "reviewer.human-signals",
        "reviewer.format",
        "reviewer.topic",
        "reviewer.platform",
        "reviewer.visual",
        "reviewer.editor"
      ],
      "limitations": [
        "Method example; it contains no real company metric or market comparison."
      ]
    },
    {
      "id": "example.ru.dzen.reader-promise",
      "revision": "ru-dzen-reader-promise-r1",
      "status": "reviewed",
      "language": "ru",
      "content_type": "article",
      "topic": "lifestyle",
      "platform": "dzen",
      "visual_mode": "none",
      "visual_decision": "none",
      "path": "examples/ru/dzen/reader-promise.md",
      "sha256": "4f09254ca7a735d2d939c60df4360a5b0b88f76b02342580f2597197bb3f73d3",
      "reviewers": [
        "reviewer.source",
        "reviewer.language",
        "reviewer.human-signals",
        "reviewer.format",
        "reviewer.topic",
        "reviewer.platform",
        "reviewer.editor"
      ],
      "limitations": [
        "Method example; it contains no external Dzen metric, monetization promise, traffic claim, or moderation outcome."
      ]
    },
    {
      "id": "example.ru.article.health",
      "revision": "ru-health-evidence-article-r1",
      "status": "reviewed",
      "language": "ru",
      "content_type": "article",
      "topic": "health",
      "platform": "blog",
      "visual_mode": "none",
      "visual_decision": "none",
      "path": "examples/ru/article/health.md",
      "sha256": "4e6e86da32c0e26679bf77b4c926a4e4a8a3002493959384ea2374828571fbf6",
      "reviewers": [
        "reviewer.source",
        "reviewer.language",
        "reviewer.human-signals",
        "reviewer.format",
        "reviewer.topic",
        "reviewer.platform",
        "reviewer.editor"
      ],
      "limitations": [
        "Editorial guidance only; it contains no diagnosis, treatment, dosage, or emergency instruction."
      ]
    },
    {
      "id": "example.ru.article.finance",
      "revision": "ru-finance-claims-article-r1",
      "status": "reviewed",
      "language": "ru",
      "content_type": "article",
      "topic": "finance",
      "platform": "blog",
      "visual_mode": "none",
      "visual_decision": "none",
      "path": "examples/ru/article/finance.md",
      "sha256": "816390216d8b3d06a0c33634395444f8c60aba586ae7008ad5bd6290df047c80",
      "reviewers": [
        "reviewer.source",
        "reviewer.language",
        "reviewer.human-signals",
        "reviewer.format",
        "reviewer.topic",
        "reviewer.platform",
        "reviewer.editor"
      ],
      "limitations": [
        "Editorial guidance only; it contains no current financial data or personalized advice."
      ]
    },
    {
      "id": "example.ru.setka.culture-context",
      "revision": "ru-setka-culture-context-r1",
      "status": "reviewed",
      "language": "ru",
      "content_type": "article",
      "topic": "culture",
      "platform": "setka",
      "visual_mode": "auto",
      "visual_decision": "none",
      "path": "examples/ru/setka/culture-context.md",
      "sha256": "4884fc302585f4102729ca501140c5c8b2ee6203135a09537fcd605cc39c44b6",
      "reviewers": [
        "reviewer.source",
        "reviewer.language",
        "reviewer.human-signals",
        "reviewer.format",
        "reviewer.topic",
        "reviewer.platform",
        "reviewer.visual",
        "reviewer.editor"
      ],
      "limitations": [
        "Method example; it does not interpret a real work, archive, creator, or community."
      ]
    },
    {
      "id": "example.ru.social.lifestyle-recommendation",
      "revision": "ru-social-lifestyle-recommendation-r1",
      "status": "reviewed",
      "language": "ru",
      "content_type": "social-post",
      "topic": "lifestyle",
      "platform": "social",
      "visual_mode": "none",
      "visual_decision": "none",
      "path": "examples/ru/social/lifestyle-recommendation.md",
      "sha256": "1e78ebbb2da08b9a6de04eaf197d7a05536f963e8f22aa5c0ea3aa856896189d",
      "reviewers": [
        "reviewer.source",
        "reviewer.language",
        "reviewer.human-signals",
        "reviewer.format",
        "reviewer.topic",
        "reviewer.platform",
        "reviewer.editor"
      ],
      "limitations": [
        "Method example; it contains no product, personal experience, price, or endorsement."
      ]
    },
    {
      "id": "example.ru.social.education-explainer",
      "revision": "ru-social-education-explainer-r1",
      "status": "reviewed",
      "language": "ru",
      "content_type": "social-post",
      "topic": "education",
      "platform": "social",
      "visual_mode": "none",
      "visual_decision": "none",
      "path": "examples/ru/social/education-explainer.md",
      "sha256": "15c55105a0acfc9cb8f18556ea865b29cdca77ab86a047a61f9b274913e590b8",
      "reviewers": [
        "reviewer.source",
        "reviewer.language",
        "reviewer.human-signals",
        "reviewer.format",
        "reviewer.topic",
        "reviewer.platform",
        "reviewer.editor"
      ],
      "limitations": [
        "Method example; it reports no real learner, course, intervention, or measured outcome."
      ]
    },
    {
      "id": "example.ru.article.travel",
      "revision": "ru-travel-planning-article-r1",
      "status": "reviewed",
      "language": "ru",
      "content_type": "article",
      "topic": "travel",
      "platform": "blog",